superiotool r
Probing for ALi Super I/O at 0x3f0...
  Failed. Returned data: id=0xffff, rev=0xff
Probing for ALi Super I/O at 0x370...
  Failed. Returned data: id=0xffff, rev=0xff
Probing for Aspeed Super I/O at 0x2e...
  Failed. Returned data: scratch registers all read as 0xff
Probing for Aspeed Super I/O at 0x4e...
  Failed. Returned data: scratch registers all read as 0xff
Probing for Exar Super I/O at 0x2e...
  Failed. Returned data: vid=0xffff, id=0xffff
Probing for Exar Super I/O at 0x4e...
  Failed. Returned data: vid=0xffff, id=0xffff
Probing for Fintek Super I/O at 0x2e...
  Failed. Returned data: vid=0xffff, id=0xffff
Probing for Fintek Super I/O at 0x4e...
  Failed. Returned data: vid=0x6400, id=0x33c3
Probing for Fintek Super I/O at 0x2e...
  Failed. Returned data: vid=0xffff, id=0xffff
Probing for Fintek Super I/O at 0x4e...
  Failed. Returned data: vid=0xffff, id=0xffff
Probing for ITE Super I/O (init=standard) at 0x20e...
  Failed. Returned data: id=0xffff, rev=0xf
Probing for ITE Super I/O (init=it8502e) at 0x20e...
  Failed. Returned data: id=0xffff, rev=0xf
Probing for ITE Super I/O (init=it8761e) at 0x20e...
  Failed. Returned data: id=0xffff, rev=0xf
Probing for ITE Super I/O (init=it8228e) at 0x20e...
  Failed. Returned data: id=0xffff, rev=0xf
Probing for ITE Super I/O (init=it8987e) at 0x20e...
  Failed. Returned data: id=0xffff, rev=0xf
Probing for ITE Super I/O (init=0x87,0x87) at 0x20e...
  Failed. Returned data: id=0xffff, rev=0xf
Probing for ITE Super I/O (init=standard) at 0x25e...
  Failed. Returned data: id=0x0000, rev=0x0
Probing for ITE Super I/O (init=it8502e) at 0x25e...
  Failed. Returned data: id=0x0000, rev=0x0
Probing for ITE Super I/O (init=it8761e) at 0x25e...
  Failed. Returned data: id=0x0000, rev=0x0
Probing for ITE Super I/O (init=it8228e) at 0x25e...
  Failed. Returned data: id=0x0000, rev=0x0
Probing for ITE Super I/O (init=it8987e) at 0x25e...
  Failed. Returned data: id=0x0000, rev=0x0
Probing for ITE Super I/O (init=0x87,0x87) at 0x25e...
  Failed. Returned data: id=0x0000, rev=0x0
Probing for ITE Super I/O (init=standard) at 0x2e...
  Failed. Returned data: id=0xffff, rev=0xf
Probing for ITE Super I/O (init=it8502e) at 0x2e...
  Failed. Returned data: id=0xffff, rev=0xf
Probing for ITE Super I/O (init=it8761e) at 0x2e...
  Failed. Returned data: id=0xffff, rev=0xf
Probing for ITE Super I/O (init=it8228e) at 0x2e...
  Failed. Returned data: id=0xffff, rev=0xf
Probing for ITE Super I/O (init=it8987e) at 0x2e...
  Failed. Returned data: id=0xffff, rev=0xf
Probing for ITE Super I/O (init=0x87,0x87) at 0x2e...
  Failed. Returned data: id=0xffff, rev=0xf
Probing for ITE Super I/O (init=standard) at 0x4e...
  Failed. Returned data: id=0xffff, rev=0xf
Probing for ITE Super I/O (init=it8502e) at 0x4e...
  Failed. Returned data: id=0xffff, rev=0xf
Probing for ITE Super I/O (init=it8761e) at 0x4e...
  Failed. Returned data: id=0xffff, rev=0xf
Probing for ITE Super I/O (init=it8228e) at 0x4e...
  Failed. Returned data: id=0xffff, rev=0xf
Probing for ITE Super I/O (init=it8987e) at 0x4e...
  Failed. Returned data: id=0xffff, rev=0xf
Probing for ITE Super I/O (init=0x87,0x87) at 0x4e...
  Failed. Returned data: id=0xc333, rev=0xf
Probing for ITE Super I/O (init=legacy/it8661f) at 0x370...
  Failed. Returned data: id=0xffff, rev=0xf
Probing for ITE Super I/O (init=legacy/it8671f) at 0x370...
  Failed. Returned data: id=0xffff, rev=0xf
Probing for ITE Super I/O (init=standard) at 0x6e...
  Failed. Returned data: id=0xffff, rev=0xf
Probing for ITE Super I/O (init=it8502e) at 0x6e...
  Failed. Returned data: id=0xffff, rev=0xf
Probing for ITE Super I/O (init=it8761e) at 0x6e...
  Failed. Returned data: id=0xffff, rev=0xf
Probing for ITE Super I/O (init=it8228e) at 0x6e...
  Failed. Returned data: id=0xffff, rev=0xf
Probing for ITE Super I/O (init=it8987e) at 0x6e...
  Failed. Returned data: id=0xffff, rev=0xf
Probing for ITE Super I/O (init=0x87,0x87) at 0x6e...
  Failed. Returned data: id=0xffff, rev=0xf
Probing for NSC Super I/O at 0x2e...
  Failed. Returned data: port=0xff, port+1=0xff
Probing for NSC Super I/O at 0x4e...
  Failed. Returned data: port=0xff, port+1=0xff
Probing for NSC Super I/O at 0x15c...
  Failed. Returned data: port=0xff, port+1=0xff
Probing for NSC Super I/O at 0x164e...
  Failed. Returned data: port=0xff, port+1=0xff
Probing for Nuvoton Super I/O at 0x164e...
  Failed. Returned data: chip_id=0xffff
Probing for Nuvoton Super I/O (sid=0xfc) at 0x164e...
  Failed. Returned data: sid=0xff, id=0xffff, rev=0x00
Probing for Nuvoton Super I/O at 0x2e...
  Failed. Returned data: chip_id=0xffff
Probing for Nuvoton Super I/O (sid=0xfc) at 0x2e...
  Failed. Returned data: sid=0xff, id=0xffff, rev=0x00
Probing for Nuvoton Super I/O at 0x4e...
Found Nuvoton NCT6776F/D (C) (id=0xc333) at 0x4e
Register dump:
idx 10 11 13 14 16 17 18 19  1a 1b 1c 1d 1e 1f 20 21  22 23 24 25 26 27 28 2a  2b 2c 2d 2e 2f
val ff ff ff ff ff ff ff ff  f0 78 00 00 ff ff c3 33  ff 00 64 00 40 c1 00 88  08 80 00 00 00
def ff ff 00 00 ff ff ff ff  f0 78 00 00 ff ff c3 33  ff 00 64 00 MM 00 00 c0  00 81 00 00 MM
LDN 0x00 (FDC)
idx 30 60 61 70 74 f0 f1 f2  f4 f5
val 01 03 f0 06 02 0e 00 ff  00 00
def 01 03 f0 06 02 0e 00 ff  00 00
LDN 0x01 (Parallel Port)
idx 30 60 61 70 74 f0
val 01 03 78 07 04 3f
def 01 03 78 07 04 3f
LDN 0x02 (UART A)
idx 30 60 61 70 f0 f2
val 01 03 f8 04 00 00
def 01 03 f8 04 00 00
LDN 0x03 (UART B, IR)
idx 30 60 61 70 f0 f1 f2
val 01 02 f8 03 00 00 00
def 01 02 f8 03 00 00 00
LDN 0x05 (Keyboard Controller)
idx 30 60 61 62 63 70 72 f0
val 01 00 60 00 64 01 0c 83
def 00 00 00 00 00 00 00 83
LDN 0x06 (CIR)
idx 30 60 61 70 f0 f1 f2 f3
val 01 02 40 03 08 09 32 00
def 00 00 00 00 08 09 32 00
LDN 0x07 (GPIO6, GPIO7, GPIO8, GPIO9)
idx 30 e0 e1 e2 e3 e4 e5 e6  e7 e8 e9 ea eb ec ed ee  f4 f5 f6 f7 f8
val 03 9f df 00 bf ed c5 00  c7 0f 0c 00 0c 20 00 00  ff ff ff ff ff
def 03 ff 00 00 00 ef 00 00  00 ff 00 00 00 00 00 00  ff 00 00 00 00
LDN 0x08 (WDT1, GPIO0, GPIO1, GPIOA)
idx 30 60 61 e0 e1 e2 e3 e4  f0 f1 f2 f3 f4 f5 f6 f7
val 02 00 00 ff 00 00 00 00  ff ff ff ff ff ff 00 ff
def 02 00 00 ff 00 00 00 00  ff 00 00 00 00 00 00 00
LDN 0x09 (GPIO2, GPIO3, GPIO4, GPIO5)
idx 30 e0 e1 e2 e3 e4 e5 e6  e7 e8 e9 ea eb ee f0 f1  f2 f4 f5 f6 f7 fe
val 8c ff 00 00 00 f7 00 00  08 ff 00 08 ff ff ff ff  ff ff ff ff ff 00
def 04 df 00 00 00 ff 00 00  00 00 00 00 00 00 ff 00  00 ff 00 00 00 00
LDN 0x0a (ACPI)
idx e0 e1 e2 e3 e4 e5 e6 e7  e9 ee f0 f2 f3 f4 f6 f7  fe
val 09 00 00 14 20 02 4c 00  00 00 00 5c 00 00 00 c8  00
def 01 00 00 00 00 02 1c 00  00 00 00 5c 00 00 00 c0  00
LDN 0x0b (Hardware Monitor, Front Panel LED)
idx 30 60 61 62 63 70 e0 e1  e2 f0 f1 f2 f5 f6 f7 f8  f9 fa
val 01 0a 00 02 a0 00 7f 7f  ff 00 00 00 10 00 40 47  00 00
def 00 00 00 00 00 00 7f 7f  ff 00 00 00 10 00 87 47  00 00
LDN 0x0d (VID)
idx e0 e1 e2 e3 e4 e5 e6 e9  ee ef f0 f4 f5
val 00 00 00 00 00 00 00 00  88 00 00 00 00
def 00 00 00 00 00 00 00 00  88 00 00 00 00
LDN 0x0e (CIR WAKE-UP)
idx 30 60 61 70
val 01 02 50 00
def 00 00 00 00
LDN 0x0f (GPIO Push-Pull or Open-drain)
idx e0 e1 e2 e3 e4 e5 e6 e7  e8 e9 f0 f1 f2
val ff df ff fe f6 ff ff d3  ff 9f 00 00 00
def ff df ff fe f6 ff ff d3  ff 9f 00 00 00
LDN 0x14 (SVID)
idx e0 e1 e3 e4
val 00 80 00 00
def 00 80 00 00
LDN 0x16 (Deep Sleep)
idx 30 e0 e1 e2
val 20 20 04 05
def 20 20 04 05
LDN 0x17 (GPIOA)
idx e0 e1 e2 e3 e4 e5
val ff ff ff ff 01 ff
def 01 00 00 00 01 00
Bank 0:
    00 01 02 03 04 05 06 07 08 09 0a 0b 0c 0d 0e 0f 
00: 04 7f 04 66 01 ff ff ff ff ff ff ff ff ff ff ff 
01: 04 ff 00 00 66 00 ff ff 40 00 00 00 00 7d 00 00 
02: e1 a9 d1 d0 7d 00 1c 41 ff ff ff da 00 00 00 00 
03: 00 00 00 00 00 00 00 00 00 00 00 ff ff ff ff ff 
04: 03 df 5b ff ff 00 3f ff 2d ff ff ff 18 05 00 a3 
05: ff ff ff ff ff ff ff ff c1 ff ff ff ff 0c 0c ff 
06: 00 ff ff ff ff 01 00 ff ff ff ff ff ff ff ff ff 
07: 00 0a 00 41 00 32 00 2b 80 ff ff ff ff ff ff ff 
08: ff 03 1f 0f ff 3c 3c 3c 00 00 00 00 00 00 00 00 
09: 0a 00 00 00 00 0a 0a 0a 0a aa ef 80 ff 40 46 c4 
0a: 0e 01 00 00 ff 00 00 ff 00 00 80 66 66 06 01 01 
0b: 00 00 00 00 00 00 30 00 1c 00 00 34 28 80 c4 ff 
0c: 01 00 00 00 00 00 00 00 00 1c 07 ff ff ff ff ff 
0d: ff ff ff ff ff ff ff ff ff ff ff ff ff ff ff ff 
0e: ff ff ff ff ff ff ff ff ff ff ff ff ff ff ff ff 
0f: ff ff ff ff ff ff ff ff ff ff ff ff ff ff ff ff 
Bank 1:
    00 01 02 03 04 05 06 07 08 09 0a 0b 0c 0d 0e 0f 
00: 01 00 00 0a 0a 01 01 3c ff 7f ff ff 00 ff ff ff 
01: ff ff ff ff ff ff ff ff ff ff ff ff ff ff ff ff 
02: 00 19 23 2d 37 ff ff 8c aa c8 e6 ff ff ff ff ff 
03: ff 00 ff ff 00 3c ff ff 00 01 00 00 00 00 00 00 
04: ff ff ff ff ff a4 00 ff ff ff ff ff ff ff 01 ff 
05: 28 00 00 4b 00 50 00 ff ff ff ff ff ff ff ff ff 
06: ff ff ff ff ff ff ff ff ff ff ff ff ff ff ff ff 
07: ff ff ff ff ff ff ff ff ff ff ff ff ff ff ff ff 
08: ff ff ff ff ff ff ff ff ff ff ff ff ff ff ff ff 
09: ff ff ff ff ff ff ff ff ff ff ff ff ff ff ff ff 
0a: ff ff ff ff ff ff ff ff ff ff ff ff ff ff ff ff 
0b: ff ff ff ff ff ff ff ff ff ff ff ff ff ff ff ff 
0c: ff ff ff ff ff ff ff ff ff ff ff ff ff ff ff ff 
0d: ff ff ff ff ff ff ff ff ff ff ff ff ff ff ff ff 
0e: ff ff ff ff ff ff ff ff ff ff ff ff ff ff ff ff 
0f: ff ff ff ff ff ff ff ff ff ff ff ff ff ff ff ff 
Bank 2:
    00 01 02 03 04 05 06 07 08 09 0a 0b 0c 0d 0e 0f 
00: 0c 32 44 03 06 01 01 3c ff 66 ff ff 00 ff ff ff 
01: ff ff ff ff ff ff ff ff ff ff ff ff ff ff ff ff 
02: 01 4e 4e 4e 58 ff ff 66 66 66 ff ff ff ff ff ff 
03: ff 00 ff ff 00 58 ff ff 02 83 01 02 0f 43 00 00 
04: ff ff ff ff ff 7f 0c ff ff ff ff ff ff ff 02 ff 
05: 2b 80 00 4b 00 50 00 ff ff ff ff ff ff ff ff ff 
06: ff ff ff ff ff ff ff ff ff ff ff ff ff ff ff ff 
07: ff ff ff ff ff ff ff ff ff ff ff ff ff ff ff ff 
08: ff ff ff ff ff ff ff ff ff ff ff ff ff ff ff ff 
09: ff ff ff ff ff ff ff ff ff ff ff ff ff ff ff ff 
0a: ff ff ff ff ff ff ff ff ff ff ff ff ff ff ff ff 
0b: ff ff ff ff ff ff ff ff ff ff ff ff ff ff ff ff 
0c: ff ff ff ff ff ff ff ff ff ff ff ff ff ff ff ff 
0d: ff ff ff ff ff ff ff ff ff ff ff ff ff ff ff ff 
0e: ff ff ff ff ff ff ff ff ff ff ff ff ff ff ff ff 
0f: ff ff ff ff ff ff ff ff ff ff ff ff ff ff ff ff 
Bank 3:
    00 01 02 03 04 05 06 07 08 09 0a 0b 0c 0d 0e 0f 
00: 03 00 00 0a 0a 01 01 3c ff ff ff ff 00 ff ff ff 
01: ff ff ff ff ff ff ff ff ff ff ff ff ff ff ff ff 
02: 00 19 23 2d 37 ff ff 8c aa c8 e6 ff ff ff ff ff 
03: ff 00 ff ff 00 3c ff ff 00 01 00 00 00 00 00 00 
04: ff ff ff ff ff a4 00 ff ff ff ff ff ff ff 03 ff 
05: ff ff ff ff ff ff ff ff ff ff ff ff ff ff ff ff 
06: ff ff ff ff ff ff ff ff ff ff ff ff ff ff ff ff 
07: ff ff ff ff ff ff ff ff ff ff ff ff ff ff ff ff 
08: ff ff ff ff ff ff ff ff ff ff ff ff ff ff ff ff 
09: ff ff ff ff ff ff ff ff ff ff ff ff ff ff ff ff 
0a: ff ff ff ff ff ff ff ff ff ff ff ff ff ff ff ff 
0b: ff ff ff ff ff ff ff ff ff ff ff ff ff ff ff ff 
0c: ff ff ff ff ff ff ff ff ff ff ff ff ff ff ff ff 
0d: ff ff ff ff ff ff ff ff ff ff ff ff ff ff ff ff 
0e: ff ff ff ff ff ff ff ff ff ff ff ff ff ff ff ff 
0f: ff ff ff ff ff ff ff ff ff ff ff ff ff ff ff ff 
Bank 4:
    00 01 02 03 04 05 06 07 08 09 0a 0b 0c 0d 0e 0f 
00: 2d 00 00 00 00 00 00 00 00 00 00 00 00 00 00 00 
01: 00 00 00 00 00 00 00 00 00 00 00 ff ff ff ff ff 
02: ff ff ff 96 64 96 64 e1 96 ff ff ff ff ff ff ff 
03: ff ff ff ff ff ff ff ff ff ff ff ff ff ff ff ff 
04: 3f 00 01 ff ff ff ff ff ff ff ff ff ff ff 04 ff 
05: 31 13 ff ff 00 00 00 ff 00 df 0d 91 09 ff ff ff 
06: ff 01 00 00 00 00 00 00 ff ff ff ff ff ff ff ff 
07: ff ff ff ff ff ff ff ff ff ff ff ff ff ff ff ff 
08: ff ff ff ff ff ff ff ff ff ff ff ff ff ff ff ff 
09: ff ff ff ff ff ff ff ff ff ff ff ff ff ff ff ff 
0a: ff ff ff ff ff ff ff ff ff ff ff ff ff ff ff ff 
0b: ff ff ff ff ff ff ff ff ff ff ff ff ff ff ff ff 
0c: ff ff ff ff ff ff ff ff ff ff ff ff ff ff ff ff 
0d: ff ff ff ff ff ff ff ff ff ff ff ff ff ff ff ff 
0e: ff ff ff ff ff ff ff ff ff ff ff ff ff ff ff ff 
0f: ff ff ff ff ff ff ff ff ff ff ff ff ff ff ff ff 
Bank 5:
    00 01 02 03 04 05 06 07 08 09 0a 0b 0c 0d 0e 0f 
00: ff ff 00 00 00 00 ff ff ff ff ff ff ff 00 00 ff 
01: ff ff ff ff ff ff ff ff ff ff ff ff ff ff ff ff 
02: ff ff ff ff ff ff ff ff ff ff ff ff ff ff ff ff 
03: ff ff ff ff ff ff ff ff ff ff ff ff ff ff ff ff 
04: ff ff ff ff ff ff ff ff ff ff ff ff ff ff 05 ff 
05: cf 00 00 ff 00 00 00 00 ff ff ff ff ff ff ff ff 
06: 00 00 00 00 00 00 07 01 01 ff ff ff ff ff ff ff 
07: ff ff ff ff ff ff ff ff ff ff ff ff ff ff ff ff 
08: ff ff ff ff ff ff ff ff ff ff ff ff ff ff ff ff 
09: ff ff ff ff ff ff ff ff ff ff ff ff ff ff ff ff 
0a: ff ff ff ff ff ff ff ff ff ff ff ff ff ff ff ff 
0b: ff ff ff ff ff ff ff ff ff ff ff ff ff ff ff ff 
0c: ff ff ff ff ff ff ff ff ff ff ff ff ff ff ff ff 
0d: ff ff ff ff ff ff ff ff ff ff ff ff ff ff ff ff 
0e: ff ff ff ff ff ff ff ff ff ff ff ff ff ff ff ff 
0f: ff ff ff ff ff ff ff ff ff ff ff ff ff ff ff ff 
Bank 6:
    00 01 02 03 04 05 06 07 08 09 0a 0b 0c 0d 0e 0f 
00: 00 00 ff ff ff ff ff ff ff ff ff ff ff ff ff ff 
01: ff ff ff ff ff ff ff ff ff ff ff ff ff ff ff ff 
02: ff 01 02 03 0e 01 01 ff 00 00 00 2d 41 41 00 ff 
03: ff 1f 0d 06 ff 1f ff 1f ff 1f 00 00 00 00 00 00 
04: 00 00 00 00 02 02 02 ff ff ff ff ff ff ff 06 ff 
05: 7f 7f 7f 7f 7f 7f 00 a4 0c 7f 00 a4 00 a4 00 a4 
06: ff ff ff ff ff ff ff ff ff ff ff ff ff ff ff ff 
07: 7f 7f 50 4b 04 7f 7f 50 4b 04 7f 7f 50 4b 04 ff 
08: ff ff ff ff ff ff ff ff ff ff ff ff ff ff ff ff 
09: ff ff ff ff ff ff ff ff ff ff ff ff ff ff ff ff 
0a: ff ff ff ff ff ff ff ff ff ff ff ff ff ff ff ff 
0b: ff ff ff ff ff ff ff ff ff ff ff ff ff ff ff ff 
0c: ff ff ff ff ff ff ff ff ff ff ff ff ff ff ff ff 
0d: ff ff ff ff ff ff ff ff ff ff ff ff ff ff ff ff 
0e: ff ff ff ff ff ff ff ff ff ff ff ff ff ff ff ff 
0f: ff ff ff ff ff ff ff ff ff ff ff ff ff ff ff ff 
Bank 7:
    00 01 02 03 04 05 06 07 08 09 0a 0b 0c 0d 0e 0f 
00: ff 95 02 10 00 00 00 00 00 69 00 00 00 00 00 00 
01: 00 00 00 00 00 00 00 f2 5e f8 80 f8 80 f8 80 01 
02: 32 01 07 00 00 00 ef 0a 00 ef 00 00 00 00 00 00 
03: 00 00 00 ff ff ff ff ff ff ff ff ff ff ff ff ff 
04: ff ff ff ff ff ff ff ff ff ff ff ff ff ff 07 ff 
05: ff ff ff ff ff ff ff ff ff ff ff ff ff ff ff ff 
06: ff ff ff ff ff ff ff ff ff ff ff ff ff ff ff ff 
07: ff ff ff ff ff ff ff ff ff ff ff ff ff ff ff ff 
08: ff ff ff ff ff ff ff ff ff ff ff ff ff ff ff ff 
09: ff ff ff ff ff ff ff ff ff ff ff ff ff ff ff ff 
0a: ff ff ff ff ff ff ff ff ff ff ff ff ff ff ff ff 
0b: ff ff ff ff ff ff ff ff ff ff ff ff ff ff ff ff 
0c: ff ff ff ff ff ff ff ff ff ff ff ff ff ff ff ff 
0d: ff ff ff ff ff ff ff ff ff ff ff ff ff ff ff ff 
0e: ff ff ff ff ff ff ff ff ff ff ff ff ff ff ff ff 
0f: ff ff ff ff ff ff ff ff ff ff ff ff ff ff ff ff 
Probing for SMSC Super I/O (idregs=0x20/0x21) at 0x2e...
  Failed. Returned data: id=0xff, rev=0xff
Probing for SMSC Super I/O (idregs=0x0d/0x0e) at 0x2e...
  Failed. Returned data: id=0xff, rev=0xff
Probing for SMSC Super I/O (idregs=0x20/0x21) at 0x4e...
  Failed. Returned data: id=0xff, rev=0xff
Probing for SMSC Super I/O (idregs=0x0d/0x0e) at 0x4e...
  Failed. Returned data: id=0xff, rev=0xff
Probing for SMSC Super I/O (idregs=0x20/0x21) at 0x162e...
  Failed. Returned data: id=0xff, rev=0xff
Probing for SMSC Super I/O (idregs=0x0d/0x0e) at 0x162e...
  Failed. Returned data: id=0xff, rev=0xff
Probing for SMSC Super I/O (idregs=0x20/0x21) at 0x164e...
  Failed. Returned data: id=0xff, rev=0xff
Probing for SMSC Super I/O (idregs=0x0d/0x0e) at 0x164e...
  Failed. Returned data: id=0xff, rev=0xff
Probing for SMSC Super I/O (idregs=0x20/0x21) at 0x3f0...
  Failed. Returned data: id=0xff, rev=0xff
Probing for SMSC Super I/O (idregs=0x0d/0x0e) at 0x3f0...
  Failed. Returned data: id=0xff, rev=0xff
Probing for SMSC Super I/O (idregs=0x20/0x21) at 0x370...
  Failed. Returned data: id=0xff, rev=0xff
Probing for SMSC Super I/O (idregs=0x0d/0x0e) at 0x370...
  Failed. Returned data: id=0xff, rev=0xff
Probing for Winbond Super I/O (init=0x88) at 0x2e...
  Failed. Returned data: id/oldid=0xff/0x0f, rev=0xff
Probing for Winbond Super I/O (init=0x89) at 0x2e...
  Failed. Returned data: id/oldid=0xff/0x0f, rev=0xff
Probing for Winbond Super I/O (init=0x86,0x86) at 0x2e...
  Failed. Returned data: id/oldid=0xff/0x0f, rev=0xff
Probing for Winbond Super I/O (init=0x87,0x87) at 0x2e...
  Failed. Returned data: id/oldid=0xff/0x0f, rev=0xff
Probing for Winbond Super I/O (init=0x88) at 0x4e...
  Failed. Returned data: id/oldid=0xff/0x0f, rev=0xff
Probing for Winbond Super I/O (init=0x89) at 0x4e...
  Failed. Returned data: id/oldid=0xff/0x0f, rev=0xff
Probing for Winbond Super I/O (init=0x86,0x86) at 0x4e...
  Failed. Returned data: id/oldid=0xff/0x0f, rev=0xff
Probing for Winbond Super I/O (init=0x87,0x87) at 0x4e...
  Failed. Returned data: id/oldid=0xc3/0x0f, rev=0x33
Probing for Winbond Super I/O (init=0x88) at 0x3f0...
  Failed. Returned data: id/oldid=0xff/0x0f, rev=0xff
Probing for Winbond Super I/O (init=0x89) at 0x3f0...
  Failed. Returned data: id/oldid=0xff/0x0f, rev=0xff
Probing for Winbond Super I/O (init=0x86,0x86) at 0x3f0...
  Failed. Returned data: id/oldid=0xff/0x0f, rev=0xff
Probing for Winbond Super I/O (init=0x87,0x87) at 0x3f0...
  Failed. Returned data: id/oldid=0xff/0x0f, rev=0xff
Probing for Winbond Super I/O (init=0x88) at 0x370...
  Failed. Returned data: id/oldid=0xff/0x0f, rev=0xff
Probing for Winbond Super I/O (init=0x89) at 0x370...
  Failed. Returned data: id/oldid=0xff/0x0f, rev=0xff
Probing for Winbond Super I/O (init=0x86,0x86) at 0x370...
  Failed. Returned data: id/oldid=0xff/0x0f, rev=0xff
Probing for Winbond Super I/O (init=0x87,0x87) at 0x370...
  Failed. Returned data: id/oldid=0xff/0x0f, rev=0xff
Probing for Winbond Super I/O (init=0x88) at 0x250...
  Failed. Returned data: id/oldid=0x01/0x01, rev=0x01
Probing for Winbond Super I/O (init=0x89) at 0x250...
  Failed. Returned data: id/oldid=0x01/0x01, rev=0x01
Probing for Winbond Super I/O (init=0x86,0x86) at 0x250...
  Failed. Returned data: id/oldid=0x01/0x01, rev=0x01
Probing for Winbond Super I/O (init=0x87,0x87) at 0x250...
  Failed. Returned data: id/oldid=0x01/0x01, rev=0x01
Probing for VIA Super I/O (init=0x87,0x87) at 0x2e...
  Failed. Returned data: id=0xff, rev=0xff
Probing for VIA Super I/O (init=0x87,0x87) at 0x4e...
  Failed. Returned data: id=0xc3, rev=0x33
Probing for VIA Super I/O (init=vt82c686) at 0x3f0...
  PCI device 1106:0686 not found.
Probing for AMD EC Super I/O at 0xaa...
Probing for Server Engines Super I/O at 0x2e...
  Failed. Returned data: id=0xffff, rev=0xff
Probing for Infineon Super I/O at 0x2e...
  Failed. Returned data: id=0xff, rev=0xff
Probing for Infineon Super I/O at 0x4e...
  Failed. Returned data: id=0xff, rev=0xff
